{
  "assessment_id": "HS-YYYY-001",
  "date": "YYYY-MM-DD",
  "authorization": {
    "scope": "Describe the authorized device/lab scope",
    "authorized_by": "Researcher / organization",
    "testing_window": "YYYY-MM-DD to YYYY-MM-DD",
    "data_handling": "Synthetic or de-identified data only where possible"
  },
  "target": {
    "device_type": "Connected hearing aid",
    "manufacturer": "Unknown",
    "model": "Unknown",
    "serial_number": "De-identified research ID",
    "firmware": "Unknown",
    "companion_app": "Unknown",
    "app_version": "Unknown",
    "platform": "Unknown",
    "clinical_software": "Unknown",
    "connectivity": ["Unknown"]
  },
  "security_domains": {
    "device_identity": {"status": "not_assessed", "evidence_ids": []},
    "connectivity": {"status": "not_assessed", "evidence_ids": []},
    "pairing_authentication": {"status": "not_assessed", "evidence_ids": []},
    "services_interfaces": {"status": "not_assessed", "evidence_ids": []},
    "firmware_updates": {"status": "not_assessed", "evidence_ids": []},
    "companion_app": {"status": "not_assessed", "evidence_ids": []},
    "cloud_services": {"status": "not_assessed", "evidence_ids": []},
    "privacy": {"status": "not_assessed", "evidence_ids": []},
    "clinical_software": {"status": "not_assessed", "evidence_ids": []},
    "access_control": {"status": "not_assessed", "evidence_ids": []},
    "logging_monitoring": {"status": "not_assessed", "evidence_ids": []},
    "resilience": {"status": "not_assessed", "evidence_ids": []},
    "physical_service": {"status": "not_assessed", "evidence_ids": []}
  },
  "data_flows": [],
  "evidence": [],
  "controls": [],
  "findings": [],
  "assessment_notes": {
    "known": [],
    "unknown": [],
    "limitations": []
  }
}
